{
	"asset": {
		"referenceFilename": "myh_abc123_v01_pm.wav",
		"fileRole": "pm",
		"schemaVersion": 1
	},
	"bibliographic": {
		"primaryID": "abc123",
		"classmark": "*ABC 123",
		"formerClassmark": "*NCOW 123",
		"nonCMSID": "string123",
		"cmsItemID": "123456",
		"cmsCollectionID": "string123",
		"catalogBNumber": "B12345678",
		"mssID": "12345",
		"barcode": "33433123456789",
		"divisionCode": "myh",
		"vernacularDivisionCode": "DAN",
		"projectCode": "projectXYZ",
		"title": "Dance Audio 1",
		"date": "Late 1970s",
		"contentNotes": "media is actually Dance Audio 2 instead of Dance Audio 1"
	},
	"technical": {
		"filename": "myh_abc123_v01_pm",
		"extension": "WAV",
		"dateCreated": "2016-01-01",
		"fileFormat": "BWF",
		"audioCodec": "PCM",
		"fileSize": {
			"measure": 2000000000,
			"unit": "B"
		},
		"durationMilli": {
			"measure": 3600000,
			"unit": "ms"
		},
		"durationHuman": "1:00:00.000",
		"signalNotes": "signal undreadable at point 123"
	},
	"source": {
		"object": {
			"type": "audio grooved disc",
			"format": "disc, Edison Diamond Disc",
			"generation": "unknown",
			"volumeNumber": 1
		},
		"subObject": {
			"faceNumber": 1,
			"regionNumber": 2,
			"partNumber": 1
		},
		"physicalDescription": {
			"diameter": {
				"measure": 7,
				"unit": "in"
			},
			"stockManufacturer": "Manufacturer A",
			"stockProductID": "xyz123",
			"baseMaterial": "nickel-plated copper",
			"surfaceMaterial": "celluloid",
			"grooveOrientation": "lateral",
			"grooveWidth": "coarse"
		},
		"audioRecording": {
			"audioSoundField": "mono",
			"designatedSpeed": {
				"measure": 45,
				"unit": "rpm"
			}
		},
		"notes": {
			"physicalConditionPreShipNotes": "disc shows XYZ damage",
			"physicalConditionDigitizationNotes": "disc shows XYZ damage"
		}
	},
	"digitizationProcess": {
		"playbackDevice": {
			"serialNumber": "xyz123",
			"manufacturer": "Manufacturer B",
			"model": "Model XYZ",
			"speed": {
				"measure": 45,
				"unit": "rpm"
			},
			"phonoArm": {
				"serialNumber": "xyz123",
				"manufacturer": "Manufacturer I",
				"model": "Model XYZ"
			},
			"phonoCartridge": {
				"manufacturer": "Manufacturer G",
				"model": "Model XYZ",
				"stylusShape": "elliptical",
				"stylusSize": {
					"measure": 12,
					"unit": "mils"
				}
			},
			"trackingWeight": {
				"measure": 0.5,
				"unit": "g"
			},
			"groovedWallPlayback": "left + right",
			"phonoPreamp": {
				"serialNumber": "xyz123",
				"manufacturer": "Manufacturer H",
				"model": "Model XYZ",
				"eq": "RIAA LP",
				"eqRolloff": {
					"measure": -6,
					"unit": "dB"
				},
				"eqTurnover": {
					"measure": 250,
					"unit": "Hz"
				}
			}
		},
		"analogDigitalConverter": {
			"serialNumber": "xyz123",
			"manufacturer": "Manufacturer D",
			"model": "Model XYZ",
			"operatingLevel": {
				"measure": -20,
				"unit": "dBFS"
			}
		},
		"captureSoftware": {
			"manufacturer": "Manufacturer E",
			"productName": "Product XYZ",
			"version": "Version 123",
			"platform": "OS XYZ"
		},
		"notes": {
			"processNotes": "required intervention for reason xyz"
		}
	},
	"digitizer": {
		"operator": {
			"firstName": "Doe",
			"lastName": "Jane"
		},
		"organization": {
			"name": "Organization XYZ",
      "address": {
        "street1": "123 ABC St",
        "street2": "Suite 1234",
        "city":    "Anytown",
        "state":   "ST",
        "postalCode": "12345"
      }
		}
	}
}
